{
  "bundleId": "math-quest-release-evidence",
  "version": "1.0.0",
  "schemaVersion": 1,
  "authority": "THIS_FILE",
  "releaseTag": "v1.0.0-beta.9",
  "qualificationCommitSha": "PENDING",
  "reviewedAtUtc": "PENDING",
  "expiresAtUtc": "PENDING",
  "evidenceSuccessorPolicy": "RELEASE_EVIDENCE_SUCCESSOR_V2",
  "licence": {
    "spdx": "MIT",
    "scope": "Original Math Quest release evidence binding record.",
    "originalWork": true
  },
  "records": {
    "hostQualification": {
      "id": "EXT-HOST",
      "evidenceClass": "STRUCTURED_ASSERTION",
      "state": "DEFERRED_PRERELEASE",
      "digestMode": "CANONICAL_RECORD",
      "releaseClass": "PRERELEASE",
      "residualRisk": "GitHub Pages may receive ordinary request metadata, and its under-13 terms remain unqualified until the first stable release.",
      "claimBoundary": "BINDS_THE_RECORDED_DEFERRAL_NOT_EXTERNAL_HOST_APPROVAL"
    },
    "canaryReconciliation": {
      "id": "EXT-CANARY",
      "evidenceClass": "CANONICAL_ARTIFACT",
      "state": "PENDING",
      "digestMode": "PENDING",
      "artifactPath": "audit/trusted-https-canary-v1.json",
      "artifactSha256": "PENDING",
      "candidateSha": "PENDING",
      "workflowRunId": "PENDING",
      "workflowRunAttempt": "PENDING",
      "claimBoundary": "BINDS_VALIDATED_SANITIZED_CANARY_BYTES_FOR_THE_EXACT_CANDIDATE"
    },
    "physicalDevice": {
      "id": "EXT-DEVICE",
      "evidenceClass": "ABSENCE_RECORD",
      "state": "OPTIONAL_NOT_RUN",
      "digestMode": "NONE",
      "requiredLanes": 0,
      "passedLanes": 0,
      "primaryIPadJourneyResult": "NOT_RUN",
      "claimBoundary": "RECORDS_THAT_NO_PHYSICAL_DEVICE_PASS_IS_CLAIMED"
    },
    "independentReviewers": {
      "id": "EXT-REVIEWERS",
      "evidenceClass": "ABSENCE_RECORD",
      "state": "OPTIONAL_NOT_RUN",
      "digestMode": "NONE",
      "requiredReports": 0,
      "sealedReports": 0,
      "claimBoundary": "RECORDS_THAT_NO_OPTIONAL_SIX_REVIEWER_PASS_IS_CLAIMED"
    },
    "adjudication": {
      "id": "EXT-ADJUDICATION",
      "evidenceClass": "STRUCTURED_ASSERTION",
      "state": "PENDING",
      "digestMode": "PENDING",
      "recommendation": "PENDING",
      "decisionBasis": "PENDING",
      "claimBoundary": "BINDS_THE_RECORDED_ADJUDICATION_DECISION_NOT_REVIEWER_IDENTITY"
    },
    "findingDisposition": {
      "id": "EXT-FINDINGS",
      "evidenceClass": "STRUCTURED_ASSERTION",
      "state": "PENDING",
      "digestMode": "PENDING",
      "openCritical": "PENDING",
      "openHigh": "PENDING",
      "unacceptedMedium": "PENDING",
      "unrecordedLow": "PENDING",
      "claimBoundary": "BINDS_THE_RECORDED_FINDING_COUNTS_NOT_UNDISCOVERED_DEFECT_ABSENCE"
    },
    "hostedWindows": {
      "id": "EXT-HOSTED-WINDOWS",
      "evidenceClass": "EXTERNAL_CANONICAL_ARTIFACT",
      "state": "PENDING",
      "digestMode": "PENDING",
      "artifactPath": "audit/browser-runner-evidence-v1.json",
      "artifactSha256": "PENDING",
      "claimBoundary": "BINDS_THE_REVIEWED_BROWSER_AND_RUNNER_IDENTITY_RECORD"
    },
    "ownerAuthorization": {
      "id": "EXT-OWNER",
      "evidenceClass": "STRUCTURED_ASSERTION",
      "state": "PENDING",
      "digestMode": "PENDING",
      "releaseTag": "PENDING",
      "protectedRef": "PENDING",
      "authorizationScope": "PENDING",
      "claimBoundary": "BINDS_THE_RECORDED_OWNER_DECISION_NOT_GITHUB_AUTHENTICATION"
    }
  },
  "lifecycleState": "QUALIFICATION_PENDING"
}
